{
    "id":  "stage2",
    "order":  2,
    "titleKey":  "stage2.title",
    "goalKey":  "stage2.goal",
    "answerKey":  "stage2.flag",
    "fakeAnswerKeys":  [

                       ],
    "targets":  [
                    "3c68a27e81e2.exe"
                ],
    "tools":  [
                  "die",
                  "dnspy"
              ],
    "guideMode":  "forced",
    "steps": [
        {
            "id": "open_die",
            "textKey": "stage2.step.open_die",
            "action": "none",
            "tool": "die",
            "file": "3c68a27e81e2.exe",
            "guide": {
                "target": { "scope": "host", "key": "target:3c68a27e81e2.exe" },
                "locators": [
                    { "strategy": "host", "scope": "host", "key": "target:3c68a27e81e2.exe" }
                ],
                "overlay": { "placement": "left", "padding": 6, "gap": 14 },
                "fallback": { "scope": "host", "key": "coach" }
            }
        },
        {
            "id": "managed_runtime",
            "textKey": "stage2.hint.managed_runtime",
            "action": "none",
            "tool": "die",
            "guide": {
                "target": { "scope": "process", "process": "tool:die" },
                "locators": [
                    {
                        "strategy": "uia",
                        "scope": "process",
                        "process": "tool:die",
                        "nameContains": [ ".NET", "CLI", "CLR", "Language", "Compiler", "PE" ],
                        "contentContains": [ ".NET", "CLR", "CLI", "MSIL" ],
                        "fallbackToWindow": true,
                        "maxNodes": 2000,
                        "timeoutMs": 900,
                        "adapter": "die",
                        "role": "analysis_summary"
                    }
                ],
                "overlay": { "placement": "auto", "padding": 6, "gap": 14 },
                "fallback": { "scope": "host", "key": "coach" }
            },
            "trigger": {
                "kind": "locator_found",
                "locator": {
                    "strategy": "uia",
                    "scope": "process",
                    "process": "tool:die",
                    "adapter": "die",
                    "role": "analysis_summary",
                    "contentContains": [ ".NET", "MSIL" ],
                    "requireAllNameContains": true,
                    "fallbackToWindow": false,
                    "maxNodes": 2000,
                    "timeoutMs": 900
                }
            }
        },
        {
            "id": "open_dnspy",
            "textKey": "stage2.step.open_dnspy",
            "action": "none",
            "tool": "dnspy",
            "file": "3c68a27e81e2.exe",
            "guide": {
                "target": { "scope": "host", "key": "tool:dnspy" },
                "locators": [
                    { "strategy": "host", "scope": "host", "key": "tool:dnspy" }
                ],
                "overlay": { "placement": "auto", "padding": 6, "gap": 14 },
                "fallback": { "scope": "host", "key": "coach" }
            }
        },
        {
            "id": "load_dnspy_sample",
            "textKey": "stage2.step.load_dnspy_sample",
            "action": "none",
            "tool": "dnspy",
            "file": "3c68a27e81e2.exe",
            "guide": {
                "target": { "scope": "host", "key": "target:3c68a27e81e2.exe" },
                "locators": [
                    { "strategy": "host", "scope": "host", "key": "target:3c68a27e81e2.exe" }
                ],
                "overlay": { "placement": "left", "padding": 6, "gap": 14 },
                "fallback": { "scope": "host", "key": "coach" }
            }
        },
        {
            "id": "expand_tree",
            "textKey": "stage2.step.expand_tree",
            "action": "none",
            "tool": "dnspy",
            "guide": {
                "target": { "scope": "process", "process": "tool:dnspy" },
                "locators": [
                    {
                        "strategy": "rect",
                        "scope": "process",
                        "process": "tool:dnspy",
                        "rect": { "space": "window", "x": 0.02, "y": 0.12, "width": 0.30, "height": 0.78 }
                    },
                    {
                        "strategy": "uia",
                        "scope": "process",
                        "process": "tool:dnspy",
                        "nameContains": [ "3c68a27e81e2", "Assembly", "MainForm" ],
                        "contentContains": [ "3c68a27e81e2", "MainForm" ],
                        "fallbackToWindow": true,
                        "maxNodes": 2000,
                        "timeoutMs": 900,
                        "controlType": "TreeItem",
                        "adapter": "dnspy",
                        "role": "assembly_tree"
                    }
                ],
                "overlay": { "placement": "right", "padding": 6, "gap": 14 },
                "fallback": { "scope": "host", "key": "coach" }
            },
            "trigger": {
                "kind": "locator_found",
                "locator": {
                    "strategy": "uia",
                    "scope": "process",
                    "process": "tool:dnspy",
                    "adapter": "dnspy",
                    "role": "assembly_tree",
                    "contentContains": [ "3c68a27e81e2", "MainForm" ],
                    "requireAllNameContains": true,
                    "fallbackToWindow": false,
                    "maxNodes": 2000,
                    "timeoutMs": 900
                }
            }
        },
        {
            "id": "find_logic",
            "textKey": "stage2.step.find_logic",
            "action": "none",
            "tool": "dnspy",
            "guide": {
                "target": { "scope": "process", "process": "tool:dnspy" },
                "locators": [
                    {
                        "strategy": "rect",
                        "scope": "process",
                        "process": "tool:dnspy",
                        "rect": { "space": "window", "x": 0.32, "y": 0.12, "width": 0.64, "height": 0.78 }
                    },
                    {
                        "strategy": "uia",
                        "scope": "process",
                        "process": "tool:dnspy",
                        "nameContains": [ "MainForm", "Click", "button", "Unlock" ],
                        "contentContains": [ "MainForm", "Click", "flag" ],
                        "fallbackToWindow": true,
                        "maxNodes": 2000,
                        "timeoutMs": 900,
                        "adapter": "dnspy",
                        "role": "code_view"
                    }
                ],
                "overlay": { "placement": "left", "padding": 6, "gap": 14 },
                "fallback": { "scope": "host", "key": "coach" }
            },
            "trigger": {
                "kind": "locator_found",
                "locator": {
                    "strategy": "uia",
                    "scope": "process",
                    "process": "tool:dnspy",
                    "adapter": "dnspy",
                    "role": "code_view",
                    "contentContains": [ "0p3n", "flag{th3_3x3_1s_n0t_c_3x3}" ],
                    "requireAllNameContains": true,
                    "fallbackToWindow": false,
                    "maxNodes": 2200,
                    "timeoutMs": 950
                }
            }
        },
        {
            "id": "submit_flag",
            "textKey": "stage2.step.submit_flag",
            "action": "none",
            "guide": {
                "target": { "scope": "host", "key": "flag" },
                "locators": [
                    { "strategy": "host", "scope": "host", "key": "flag" }
                ],
                "overlay": { "placement": "top", "padding": 6, "gap": 14 },
                "fallback": { "scope": "host", "key": "coach" }
            }
        }
    ]
}
