{
    "id":  "final",
    "order":  4,
    "titleKey":  "final.title",
    "goalKey":  "final.goal",
    "answerKey":  "final.flag",
    "fakeAnswerKeys":  [

                       ],
    "targets":  [
                    "c79702ef3788.exe",
                    "19bc457728c1.exe"
                ],
    "tools":  [
                  "die",
                  "ida",
                  "dnspy",
                  "x64dbg"
              ],
    "guideMode":  "none",
    "freeExploreTextKey":  "final.brief",
    "steps":  [

              ]
}